id,name,location,description,followers,friends,verified
14922225,Ubisoft,Paris,This is the official Ubisoft Company Twitter account - stay tuned!,10104,136,False
14923512,Michele Price,"Houston,Texas","The Breakthrough Specialist-radio host-speaker-heart based leader, I help solopreneurs, service prof. grow online presence-great cook, loves rottweilers",25701,26955,False
14924114,MTV Canada,Canada,,14703,287,False
14925700,Alternative Press,"Mississauga, Ontario CA","Alternative Press Magazine: the nation’s leading voice on underground, alternative, and punk music. Check us out at altpress.com!",23375,12,False
14929948,JaWar,"Atlanta, Georgia -Los Angeles","Be Happy, Healthy and Wealthy when you THINK, PLAN, EXECUTE -JaWar: Motivational Speaker, Author, Business Consultant www.jawarspeaks.com",13173,13185,False
14933491,Sportnews:Online,Köln,"Sport - Stars - News! Cristiano, Fernando, LeBron, Tiger, Shaq und Co. Was geht ab in der Welt des Sports? Sportnews-Online weiß es!",12722,10964,False
14934818,InStyle.com,"New York, NY",InStyle.com is the #1 destination for the latest celebrity styles and click-to-buy shopping,735364,1957,False
14937188,Jeff A Smith,Nationwide,"RE Investor, Loan Mod Expert, Coach. Specializing in Loan Mods and Short Sale/REO/Commercial Funding.",14893,14796,False
14938818,Tessália Serighelli,Curitiba / Brasilia,"Depois de ter a conta Hackeada, TWITTESS IS BACK! :D Enjoy it ;D Let's have some fun ^^",50054,43675,False
14939981,Questo of The Roots,philadelphia,your favorite twitterer's favorite music snob.,578676,950,True
14944039,Nick Donnelly,"London, UK",CoFounder TweetieAndTheBrain.com. Outsourcer. Traveller. Snowboarder. Speaker. Developer. Love Photography.,13015,12619,False
14944855,Kidrobot,New York City,Kidrobot is the world’s premier designer and retailer of limited edition art toys and apparel.,14941,14591,False
14945261,Curt Schilling,"Medfield, Mass",Retired Geek,11832,12,False
14946147,Kanye_West Info,"Nashville, Tn",The latest information about Kanye West (not affiliated with Kanye West),95919,0,False
14946999,marimoon,Brasil,VJ @ MTV Brasil (Scrap Mtv),73940,97,False
14947234,NickBarnett,"iPhone: 44.421024,-88.077591",Linebacker for the Green Bay Packers,11310,45,True
14951992,Misty Belardo,"Manila, Philippines","gfx/avatar designer, blogger, events specialist, , loves music, food, travel, art and self expression.. facebook fanatic",10633,10682,False
14952156,Mike Hill,"Chico, CA","Daddy, Husband, Marketer, World Traveler, Freakazoid, Nerd, Human Living (not human being)",23731,604,False
14954259,David Smith,Australia,Changing People's Lives - One Card At A Time,16792,16985,False
14960104,Tina Sparby,"Buffalo, MN",I'm boring...really really boring...,16543,16576,False
14962703,Andy Linux,New Zealand,"I was born, found out about Linux, now I am here",14901,15795,False
14962906,Carrie Bevill,Serving all US Business Owners,"I am a Professional Internet Marketing and Web Design Consultant Experienced in 4.0 Pre-Optimized Web Design | SEO | Search Engine Optimization, for Businesses",11193,8420,False
14964767,Paul Thurrott,"Dedham, MA",Paul Thurrott is the guy behind the SuperSite for Windows. Way behind. :),19209,19382,False
14969510,Ryan Shelton,Australia,Hi. Ryan Shelton is me. Nice to e-meet you. Tweet.,15475,1287,False
14974779,The REAL Frank Kern,California,9th Worst Surfer in California,14916,33,False
14975793,Sean Roach,Global/ Vegas &amp; San Diego,"Think Engine, CEO &amp; Speaker I have a learning style that is different than most people. I approach spelling a word many different ways! YES I'm Dyslexic",16624,16496,False
14977112,Tony Galliano,"Chicago, IL",Empowering breakthrough achievement through 60 Second Strategy,35947,35461,False
14982126,jhongren,Singapore,"Wedding Blogger, Blogging Coach, Serial Internet Entrepreneur, Official John Yeo's page (BloggersPaycheck.com)",14043,12756,False
14982315,James Gunn,TEHRAN,"I like people to know when I'm drinking coffee, so I joined Twitter.",15856,33,False
14985228,Peter Sagal,Chicago,Writer and host of NPR's news quiz Wait Wait Don't Tell Me,15592,81,False
14986811,ACTORSandCREW,"Los Angeles, California",Employment and networking site for the Entertainment Industry World Wide.,11555,10183,False
14990608,CEO of Great Innovus,"Madurai,Tamilnadu, India",Web Apps and Niche web services development,37331,36696,False
14990751,Alison Agosti,"Venice, CA",Somebody once told me that I'm the cat's pajamas.,95870,101,False
14994303,J.B. Oliveira,Brasil,"fui, voltei, não sei...",29117,14,False
14994465,Jimmy Eat World,,A rock band from Arizona,793804,134525,False
14996326,Dave Saunders,"Richmond, VA",The slightly irreverent *King of New Media* President/Chief Idea Officer-Madison+Main. I fish. I golf. I karaoke. Time to be a gamechanger.,16438,13830,False
14998161,KikiValdes,"Miami, FL",Contemporary Artist/ American painter and startup CEO. Also enjoy museums and drinks with friends.,35196,36846,False
14999880,FailBlog,"Seattle, WA",,12489,845,False
15006658,secret2fatloss,"Westchester, NY",I'm bringing The Secret 2 Fat Loss to the world baby!,18087,18627,False
15010370,TOMSshoes,"Santa Monica, CA","With every pair you purchase, TOMS will give a pair of new shoes to a child in need. One for One.",24197,17666,False
15010705,Robin Harrison,Lincoln,Managing director of Dolly Char (UK) Ltd domestic cleaning franchise company,21659,23139,False
15011753,Carey Holgate,,,16360,16990,False
15012486,CBS News,"New York, NY",News alerts from CBS News.,770972,72,False
15014044,Natalie Stahl,Colorado,"Passionate World Traveler, Classical Pianist and Entrepreneur.",10809,10537,False
15017802,TheSpotter,"Virginia Beach, VA, USA","Blogger, Marketer, IT Pro, founder of www.ExpertWordPress.com and just the Nice Guy willing to share my knowledge and experience",16340,15090,False
15020865,Pittsburgh Penguins,"Pittsburgh, PA","Run by the Pittsburgh Penguins, your connection to team happenings, website updates, contests, and specials!",16002,40,False
15021099,Casey Wright,San Diego,CEO Wright Brothers Communications,107164,105027,False
15022452,Lilian Chisca,"Chisinau, Moldova","★ Twitaholic ★ Addicted to challenging myself, and writing about it along the way ★ WARNING: LOTS of Tweet",27736,28080,False
15023197,mtwarner,Texas,CEO of RealEspace online real estate and mortgage marketing. Changing mortgage marketing forever!,16385,17094,False
15023346,Rachel Green,"Plano, TX",,18249,19770,False
15023872,Hot Topic,"City Of Industry, CA",Everything About the Music,10076,186,False
15027207,Christianity Today,"Carol Stream, IL","Christianity Today is an international evangelical magazine. Billy Graham founded the magazine, which has about 140,000 subscribers.",11184,11791,False
15030098,Ryan E. Poole,"Huntsville, AL","6 Million Dollar Man / Media Mavin w 12 yrs of marketing, advertising, business development, and strategic advisory but tweeting about other stuff :)",11173,12114,False
15031424,KoldCast TV,"Irvine, CA",The Web TV Network,27169,21952,False
15033239,Allen Daniels,"WInfield, KS USA","I am a husband, father and a successful Internet marketer. I am also a student of the laws of attraction and how we work with universe to obtain our goals.",19108,19989,False
15033883,hulu,"Los Angeles, CA, USA, Earth",The official Twitter account of Hulu,18280,2007,False
15036026,benkweller,"Austin, Tx","I write songs, record them and sing them for people. I love music and Bass fishing. Most of all I love my wife Liz and my son Dorian.",10141,72,False
15039436,LoriMoreno,Chicago & World Beaches,"Escaped Corp World as Attorney. Now Enjoy Life all Over World w/ Laptop/Phone Follow Me. Love You & All Culture, Film, Plays, Art, Music, Dance, *Spiritual Muse",20819,17170,False
15039997,Wendy G Young,"Houston, TX",I'm a Bubbling Ball of Manifesting Energy & help CREATE Your Life on Purpose™ w/ Spiritual Grid Manifestation™ --- Facebook.com/Wendy.G.Young,11645,11092,False
15044502,Kelly Mitchell,"iPhone: 21.302637,-157.863941","Kelly Mitchell * Beyond the Obvious.Nine Year Honolulu Tech Exec, 30yr Kama'aina,Connector of People/Businesses,HGTV Star,Social Media Club Hawaii President",49892,49471,False
15054733,Bradley Bowden,"Dallas, TX","Happily married 2 @Truthoughts. I am the Co-founder and CEO of @GreenShield - I ♥ God, social media, having fun &amp; making money all while living green",24737,26019,False
15057943,Museum of Modern Art,"New York, New York","Victor Samra (Digital Media/Marketing @ MoMA, aka @vsamra3) at the easel",31381,739,False
15060048,Lush Life,"Brooklyn, NY",,12673,12493,False
15062528,Ian Brodie,"Manchester, UK",Helping professional service firms attract more clients and sell more effectively,13614,14440,False
15065016,Tina Williams,"Tampa, Albany and L.I.","Know-Like-Trust Simple Concept, Right? Are you someone people can Know-Like and Trust? Small Business Social Marketing Success Depends on the KLT Factor!",12007,11595,False
15065568,Derek Fredrickson,"Stamford, CT","Overall Dadpreneur. Husband, Father, Entreprenuer. Business development on programs and products for Client Attraction. Skiing and outdoors enthusiast.",10888,10786,False
15066760,Lonely Planet,"Melbourne, Oakland, London",Retweeting the best in travel. Very simple: 1. Follow us 2. Tag your tweets with #lp 3. We read your posts 4. We re-tweet the best of them,8992,8985,False
15069237,Bobbi Billard,"New York, NY","I'm Your Very Own Bobbi Doll! Model, Actress, Ex Pro Wrestler with over 1.4 MILLION MySpace friends. Search me on IMDB and click follow for more info.",16285,13320,False
15075999,Hugh Hewitt,California,Updates from HughHewitt.com,12730,42,False
15076390,Padmasree,California,CTO of Cisco,688468,70,False
15078840,AstrobiologyNAI,We've got scientists all over,NASA Astrobiology Institute: we study life in the Universe!,389834,0,False
15079003,Dave Days,Philly,"I like to make music, vids, and people laugh. Get my CD at http://www.dftba.com or iTunes.",26171,105,False
15080404,Jason M. James,"Boston, MA","Internet marketer, animal lover, U.S. Marine, fitness maniac, Cuban, blogger, affiliate marketer, movie lover, many other things including chocolate addict!",44013,34481,False
15081182,Warren Whitlock,"Las Vegas, NV","http://TwitterHandbook.com Author, Publisher, Blogger and Social Media Guy",39207,36067,False
15084438,DJ CAMILO,"JACKSON HEIGHTS, QUEENS NEW YO","INTERNATIONAL CLUB KING, HOT 97 IN NEW YORK, COLOMBIAN/BORN & RAISED IN QUEENS, NYC,",19596,260,False
15084495,Reinhard Muller,"Bargemon, France","Internet Marketer. Social Media Strategist. Coach and Speaker. Love Life, Helping Others and Human Creative Thinking. Build Your Business with Twitter.",11958,12124,False
15085591,Lou Plaia,NYC,Co-Founder of RN. RN specializes in fan relationship mgmt. 400k+ artists/labels/mgrs use the marketing platform to manage their artist to fan communications.,10631,1390,False
15086185,Brian Kurtz,"Detroit, MI","The Marine Corps was too easy on me, so I jumped into Real Estate Investing a few years ago.My Big Give is helping others attract more Followers on Twitter.",21317,23436,False
15086405,the iPhone Blog,Browser!,For those who dare to Phone different. Updated by @reneritchie @backlon,13855,294,False
15088915,TV Record,São Paulo,,8077,3,False
15091071,James Thomas,Australia,"Forex Trader, Loves To Build & Share Wealth, Into Personal Development & Empowering Others To Follow Their Bliss, Live Abundantly & Be Happy!",10329,7717,False
15091877,REGYATES,The Big Smoke,,37446,50,False
15092161,Kim Hull,"Dallas, TX","Twitter musings of Kim Hull, founder and president of Dallas marketing firm, Seven Aspens. Marketing services, Web design, Consulting, Social media marketing",11799,12095,False
15097566,Nice Kicks,"Austin, TX",,10472,121,False
15099384,TWLOHA,"Cocoa, FL","TWLOHA is a non-profit movement dedicated to presenting hope and finding help for people struggling with depression, addiction, self-injury and suicide.",33877,13,False
15099729,Tiger Woods News,,Latest news from around the web on Tiger Woods,8930,117,False
15102934,Muhammad Siddique,Suwanee GA,"Social Entrepreneur, It is all about YOU! Stompernet member.",12257,9217,False
15105269,Richard McKay,"Glasgow, United Kingdom","Zungalow.com , tweetabix.com , richardmckay.com",32352,33305,False
15108422,timheidecker,"iPhone: 34.110435,-118.257607","looking for opportunities in growth, outreach and virtual communication.",18441,37,False
15111389,Brea Grant,los angeles,that girl from that thing.,25225,265,True
15114927,Cori,"Orlando, Florida",Creative type..quiet and complex..ghostwriter to the pros..one talented chick!,15538,13370,False
15115280,iProng Magazine,"Hollywood, CA","iProng Magazine - the publication for iPhone, iPod, music, podcasting, and social media lovers",13643,13609,False
15116585,Larry Benet,"ÜT: 41.210975,-74.01449","Known as The Connecter. I l♥ve helping people connect to what they need! ♥ live concerts, FSU football-tennis. Passionate about raising money for worthy causes!",10957,11347,False
15117375,Gerald Weber,H-Town USA,I'm the kinda guy that shoots from the hip if ya know what I mean. I'm Also The H-Town SEO guy. ...I was riding a cloud the other day....,86787,89139,False
15119203,axiale05,"Dubai, UAE","Search Engine Marketing Specialist & Web Programmer by day and a random blogger at night.. SEO, PPC, SMO, SMM tweet me and I will try to help you.",14770,14606,False
15120121,Raymond Le Blanc,France,"Economist, Psychologist and Writer",35039,32076,False
15120999,hughlaurie,,Hello,33636,6,False
15122826,MC Lyte,ALL OVER THE GLOBE,MC Lyte/ ALMOST SEPTEMBER,20755,0,False
15131310,Whole Foods Market,"Austin, TX","Fresh organic tweets from Whole Foods Market HQ in Austin, TX.",1054615,490310,False
15139633,Mark_Cuban,,The feed for Mark's blog. Mark's personal twitter account is @mcuban.,28120,1,False
15140173,John O'Callaghan,"Tempe, AZ",,29784,0,False
15140284,Kennedy Brock,"Tempe, AZ",,18250,17,False
15140319,Garrett Nickelsen,"iPhone: 34.280224,-119.304962",,15401,82,False
15140362,Jared Monaco,"Tempe, AZ",,13445,13,False
15140383,Pat Kirch,"Tempe, AZ",,16089,3,False
15143725,Andrew Kelly,Melbourne,"Video Marketing Guy,Realestate Investing Coach,Wealthy Mind Mentor,Dad, Pro Sax Player,Guitar Mad",21235,21256,False
15147397,Mike Birbiglia,NYC,Comedian,16130,9,False
15151846,Douglas Stuart,Aberdeen UK,Well i'm 41 Scottish and a full time Internet Marketer who lives by the following .The More People You Help Succeed In Life The More Successful Your Own Will Be,27992,28485,False
15153064,David Gideon,USA Baby!,The subtle psychology of the female mind is my passion. Dating coach is my calling. Internet Marketing is my hobby. I drop jewels of wisdom and seek the truth,12000,12692,False
15153236,Jack Somers,"Little Rock, Arkansas","Conservative. I like the outdoors, politics, business, hunting, the internet. Pro-life, FairTax",8256,582,False
15155074,Pearl Jam Official,"Seattle, WA",Pearl Jam's Official Twitter,32555,7,False
15158328,Vitor Fasano,Rio de Janeiro,Eu gosto de me curtir,22097,5804,False
15158464,Darren Williger,"Chicago, Illinois","Success driven ex-DELL sales maker and new media evangelist by day. Meditating, guitar playing, wine making, crime fighting superhero at night. I like cheese!",64044,67886,False
15162193,Nordstrom,"Seattle, WA","Nordstrom is a leading fashion specialty retailer, offering customers one of the most extensive selections of clothing, shoes & accessories.",11368,819,False
15163383,In Style Magazine,,"The leading fashion, beauty and celebrity lifestyle site",11225,1,False
15163466,Digg 2000,,"All stories on Digg that get 2,000 or more Diggs.",534315,12,False
15164442,Danny Brown,"Burlington, ON, Canada",Join me for the 12for12k Challenge - social media for good. Ask me for information or visit http://12for12k.org,13080,8120,False
15164565,Slate,,What Slate is reading and discussing,14014,17,False
15165493,CassiniSaturn,"Saturn, Solar System","Cruising around Saturn, its moons and the magnificent rings",10309,0,True
15165502,Spirit and Oppy,Mars: Gusev Crater & Meridiani,Roaming the Red Planet on six wheels. The official mission Twitter of Spirit and Opportunity,15031,4,False
15166438,RichardDawkins.com,www.RichardDawkins.com,"RichardDawkins.com, The Original Website Since 1999",16383,66,False
15166577,Joe Royall,San Francisco,"Red Hat, Open Source, Social Networking, Social Marketing....lets digg...add me to IM AIM: OOjoeDrNo http://www.linkedin.com/in/joeroyall",34877,35012,False
15169907,Bravotv,,... by Bravo,11616,147,False
15173109,Dillanos Coffee,"Seattle, WA",Dillanos Coffee Roasters-Roasting the world's smoothest coffee since 1992.,16295,16787,False
15174950,Atniz - Work At Home,"Penang, Malaysia","Full time work at home mum into blogging, High PR Dofollow Link Building, Increase SERP Ranking, Increase Page Rank, etc",15433,16600,False
15175368,The Office,Thursdays 9/8c,the official Twitter profile for The Office,73144,14,False
15178186,guardian music,"London, normally","Blogs, podcasts and other fun stuff from the guardian.co.uk/music team",13470,13,False
15179591,Jan Malloch,Scotland,"The Positive Achiever - Inspirational Author and Speaker - Be Positive, Achieve, and Enjoy!",12706,13896,False
15181500,charles brown,"Fort Worth, Texas USA",I am a web marketing coach who helps business people develop personal brands online with social networking strategies.,11955,12004,False
15182385,Pamela,At The Beach!,"Blogger, writer, artist, wife, mom to 2 dogs living in sunshine and loving life.",11321,11380,False
15183275,Productivity501,USA,Pieces of the productivity puzzle.,11765,12181,False
15184249,Casting Crowns,"Atlanta, Ga",Official Twitter Feed for Casting Crowns,12588,25,False
15192462,Darren,"Chicago, Illinois","Sharing knowledge through article writing hobby including occasional tidbits of wisdom. Here is where you will find the myth and legend, meet the man @williger.",27847,30077,False
15193239,cindysutton,"Merritt, B.C.",Free Training :) Luv 2 Empower-Inspire Women. Passionate abt Sponsoring Children in 3rd World Countries. Internet Mrktng Nut. Obsessive Learner -Exercise Freak,14373,13704,False
15195171,Debbas,Throughout the US,Founder of promotional items and printing. Professor of Marketing www.weeklyinterview.com. Writing books . Love 2 Interview U. Enjoy Wineries.,84593,87716,False
15207596,Big Brother,Elstree,Big Brother is BACK!,17107,70,False
15211524,Damien Jordan,Los Angeles Area,"Christian, California Educator, Real Estate Investor, Home Business, Internet Marketer, MLM, Video Training",12392,11905,False
15214601,Greg Martin,"Gold Coast, Australia","Cashflow 101 Devotee, Internet Marketing Aficionado, MLM Blog Partisan, Twitter Automation Savant. Just click the link above will you.",21418,22464,False
15220473,Disney World News,"Lake Buena Vista, FL",Official Walt Disney World News,27208,71,False
15221118,Chris Chadwick,"Denver, Colorado","Husband, Entrepreneur, Geek, Social media addict , Traveler, Perpetual student, due to too many bots if you dont @msg me I wont follow you back",24876,25470,False
15222197,NewAgeSelfHelp,San Diego,Be part of the New Age Self Help revolution. Creating a world that works for everyone--one relationship at a time.,15082,15588,False
15224565,Andrea Weiss,Seattle,"Mom 3 kids, Microsoft IT writer, Seattle PI Shoreline blogger, cellist @seattlephil, quilter, gardener, M/AET, Stanford alum.",30728,29464,False
15224867,Anderson Cooper,New York,"A behind the scenes look at “Anderson Cooper 360°” and the stories it covers, written by Anderson Cooper and the show’s correspondents and producers.",291467,89,True
15224941,Jack Cafferty,,Jack Cafferty sounds off hourly on the Situation Room on the stories crossing his radar.,10984,6,False
15227650,Marina Orlova,Los Angeles,PRE-ORDER MY FIRST BOOK ON AMAZON.COM,20215,236,False
15227791,William Shatner,"Los Angeles, CA",Actor,91698,9,True
15228091,Terrance Charles,"Killeen, Texas","Expert Internet Marketer, Copywriter, Squeeze Page Builder, just enjoying life and taking as much people to the top with me. Wanna join me?",15360,14593,False
15228169,Rick,"Philadelphia, PA","Founder of Vayu, yoga inspired athletic wear. Vegan. Sustainability.Contrarian. Social Media.",17731,18193,False
15230663,ralph claxton,"Detroit, MI","You dont know me yet but you will ....everyone has a Niche, what's yours?",30761,29462,False
15231287,Gartner,,Gartner is the leading global provider of independent and objective technology related research and advice.,12696,6657,False
15233739,Yanik Silver,"Potomac, MD","Author, entrepreneur, adventurer and alleged inventor of the question mark",10740,835,False
15234407,CERN,Geneva,"CERN, the European Organization for Nuclear Research, is the biggest particle physics laboratory in the world.",11080,21,False
15234546,Terry Moran,Washington DC,Nightline co-anchor,802586,134,False
15234657,Electronic Arts,"Redwood City, CA",Official Twitter account for EA. Follow for updates on all your favorite EA games,25761,86,False
15235475,BethBanning,San Diego,"Helping 2 create a world that works for everyone. Writer, Communication&Relationship Expert, Seminar Leader, Mastermind Facilitator, & Fun-Loving Chocoholic...",16023,16641,False
15238124,The Cool Hunter,New York,,11568,105,False
15240444,Joao Moraes,"Sao Paulo, SP - Brazil","Internet Marketer, SEO, SEM, website optimization, ads publisher, WordPress blog hosting, Twitter family member!",10165,8936,False
15240516,John Ray,Vancouver,"Entrepreneur, Defendo.com Instructor. Co Founder of Finnegan Web Works",19118,18394,False
15245706,Stand Up To Cancer,Everywhere,This is where the end of cancer begins. Stand up!,12777,13091,False
15249156,drhorrible,"Los Angeles, CA","The story of a low-rent super-villain, the hero who keeps beating him up, and the cute girl from the laundromat he’s too shy to talk to.",37170,21,False
15249841,diogomainardi,,,19407,3,False
15250635,DriverSide.com,"San Francisco, Ca","Because owning a car is hard, we want to make it easy.",12104,13193,False
15251613,Popjustice,LONDON,Purveyors Of Amazing Pop Music,14748,455,False
15251692,Belladonna,Planet Bella,"I own and operate Belladonna Entertainment and DeadlyNightShade Inc with my partner in crime @ContentWhore. I perform, produce, direct, photograph in Porn.",25589,33,False
15253147,Alan Carr,,,241902,25,False
15253428,David,London/Bremen,"Musician, composer creative thinker and entrepreneur",14194,14687,False
15253933,BrookeHogan,Florida and California,Singer and aspiring Actress living in this crazy fishbowl called life.,79041,40,False
15255968,insideSMMS,"Philadelphia, Pa USA","Internet Marketer who went from nothing to $25,171 on facebook in 21 days",16524,15245,False
15257727,Kseniya Savelyeva,"Toronto, Canada",Marketing Diva | Social Media Fan | Knowledge Seeker | Traveler | Fashion Addict | Food Lover,12740,12598,False
15258479,James Hickey,San Diego and South Lake Tahoe,"San Diego Entrepreneur, Internet Marketing Expert and Mentor. Tournament Chess and Semi-Pro Basketball Player. Love Traveling and Snow Skiing.",22522,21197,False
15259010,lucasartsgames,"iPhone: 37.782627,-122.402519","Official Twitter feed for LucasArts, creator of videogames from Fate of Atlantis to The Force Unleashed",11521,567,False
15260162,louis,,I prefer people send me a @louistm to a message thnx,11160,11325,False
15260302,Joshua Landsberg,Los Angeles,I am passionate about SEO | Social Marketing | Blogging | Wordpress. Living a good life in Los Angeles with my wife and daughter.,15141,15548,False
15264770,MattLevenhagen,"Milwaukee, WI, USA","Master in Targeted, Action Taking, Traffic Generation. 6+ Year Search Marketing Veteran.",12861,13059,False
15265269,David King,Detroit,"Creator of wtc method, BMIM blog, faft principle self proclaimed Internet Business King b-ball travel & TWITTER! Don't Watch me do me do you!",16146,14892,False
15265990,Owl City,Minnesota,I'm Adam. I think crocs are hilarious. The shoes.,24722,3,False
15273659,TaylorSwift,None,None,9121,0,False
15274836,Dr. Jefferson Boggs,"Paris,Rio,HK,NY - Calif. Today","I will Follow you - If you keep Following back. Tips, Quips, Laughter, Inspiration, Art, Investing, Fun and Optimism!",57728,58082,False
15275022,DP School (DPS),,"Helping Camera Owners Learn the Art of Digital Photography. Free Tips, Tutorials and a Growing Community.",13938,6050,False
15276401,Susan Elaine,North Carolina,"Hi I'm Susan from NC, Ambassador for @BCCF, Social Media Enthusiast creating social media campaigns.♥ ♥♥ Music, Movies & More! And I design t-shirts for fun!",37150,37428,False
15276785,Dan Lopez,Pocono Mountains PA,"Loving Dad & Visionary, Socializer, TechHead SEO, Focus Coach. Part Time Affiliate Marketer",13866,10184,False
15279308,Will Pao,Virginia (the mushroom region),"''Dude, Where's My Czar?'' --Coming to Theatres June 2012. No brain required.",10850,11196,False
15279429,VANITY FAIR,"New York, NY",What's new at VanityFair.com,20622,256,False
15279958,Rufus Wainwright,"New York, NY",,9964,0,False
15280385,Steve Driscoll,Los Angeles,"Quality business intelligence sought by professionals in sales, marketing, business development, executive networking, recruitment & others. Details left...",13686,12420,False
15280536,the_insider,California,The Pulse of Pop Culture,10051,1384,False
15284900,Cary Ellis,SW Colorado USA,"Healthy Diet and Lifestyle author, Founder www.virtualearthvillage.com, epubs",10675,9635,False
15285305,Lotay,"Los Angeles, California","Black Card Circle Founder. Committed optimist. Lifelong learner. Travel enthusiast. Learning the virtues of patience, forgiveness, and compassion.",54909,53526,False
15285352,29travels.com,"Sunnyvale, CA",Map your travels and embed it on your blog/website. Its super easy!,15486,16776,False
