id,name,location,description,followers,friends,verified
18055737,John Green,"Indianapolis, IN",I write books and make videos with my brother.,415362,118,False
18058016,BrianKellyIcon,,,23798,25318,False
18058609,U.S. FDA,"Washington, DC","Get notified about the U.S. Food and Drug Administration's recalls, market withdrawals and safety alerts.",10235,12,False
18066326,Dan Briffa,UK,"Internet Marketer, Entrepreneur, eBay Specialist and FUN guy!!",17149,15451,False
18066392,Nischal Shetty,"Bangalore, India",Spoilt for choice - A one stop place for finding all the COOLEST twitter apps ever made,17303,18013,False
18069722,jerry_seinfeld,NYC,What's the deal with this &quot;Twitter&quot; ?,9911,124,False
18069748,Jenna Haze,"Los Angeles, CA",Adult Icon,23973,144,False
18070850,Don Cannon,"ÜT: 33.788512,-84.391296",Mr Money Machine And Alllllllll That!,18827,4251,False
18071696,News For Gamers,New York,"Gamekicker.com - Gaming News Rating Website for all Playstation , Xbox 360, Nintendo DS, PSP, PC, Mobile Phone &amp; Online",10427,10815,False
18072400,oceanUP,Beverly Hills,Gossip.,9392,551,False
18073211,Psychic Gemstar,Canada,Psychic Empath and Energy Weaver~Private Email Readings available~Click my link for more information,63329,58118,False
18073937,Conrad Weboptimiser,"Central London, UK","FJMDN, Family, Clicks, Minutes, Cash, Fashion, Vodka, Food, HHouse, Hard Work, Fun, Art, Understatments, Fish & Chips, Yorkshire, Rugby, HTFC, F1, SriLanka",31647,33058,False
18074132,Vincent Craine,New England,Creator And Marketer of Our New Twitter Software that builds relationships Hands Free all over the World with People who have the same Interest. as You.,26803,25086,False
18075140,Bruno Aleixo,Coimbra,"Sou uma pessoa com objectivos na vida, tenho uma vida que se pode dizer porreira, tenho os dois dos melhores amigos do mundo e tenho pessoas de familia.",10810,11879,False
18077270,ghincapie,"ÜT: 43.609291,3.884906",,33929,36,False
18078179,LeBron2010.com,"Cleveland, Ohio",The Keep LeBron in Cleveland Billboard Campaign,45356,527,False
18087450,Orrin Woodward,"Port St. Lucie, Florida","NY Times and WSJ Best Seller- Launching a Leadership Revolution, HR World Top 100 and AllTop Blogger, Top 250 Twitter, Speaker, Christian, Husband, Dad",55564,58359,False
18088038,DJ Vlad - VladTV.com,http://www.VladTV.com,http://www.VladTV.com,14921,313,False
18089163,Alex Bogusky,Boulder,I've got a lot of layers but here on twitter I'm mostly the Chairman of CP+B layer.,10588,5639,False
18091904,Ashley Tisdale,"Los Angeles, CA",The Official Ashley Tisdale Twitter Page. New album GUILTY PLEASURE coming 7/28!!!,1037601,69,True
18098313,MercyMe,"Dallas, TX",The MercyMe News Twitter Page,10296,10096,False
18101713,paulfeig,,Paul is a guy who wears suits and tries not to screw things up. He also created Freaks and Geeks.,432474,53,False
18103141,Jim Gillette,"San Antonio, TX","Internet marketer, tai chi push hands player, tango dancer, thriving outside the box, decades of experience-beginner's mind, grateful",11183,10556,False
18103148,Christian Siriano,"Brooklyn, NY",My boyfriend @bradwalsh made me get a Twitter.,36637,37,False
18104516,NicheChick,"Los Angeles, CA","One FREE Killer Niche, Complete With Keyword Research, Delivered Daily. FOR FREE! :D Did I mention free?",12705,13605,False
18104730,Green Economy Init',New York,Green Economy Initiative tracks investment in green economy. Join us at greeneconomyinitiative.com,12281,4098,False
18110177,KC,"Montreal, Canada",,10095,272,False
18110989,Brynn Allen,North Shore of Oahu,"Oahu Realtor, who lives on the beach at Malaekahana Bay. I like gardening, horses &amp; finding glass balls",11717,12872,False
18112405,iget2work (sue wolf),New York/Los Angeles,"tv producer/director, creator www.iget2work.com comedy and humor for the unemployed or fed up.",13817,13799,False
18114977,Danielle aka Unique,"Scottsdale, Arizona",This is the only Danielle Pastorino aka Unique from Vh1's For the Love of Ray J twitter page. There are a ton of fakes out there but this is official!,10424,207,False
18116794,Levi Leipheimer,"Santa Rosa, Ca",Pro Cyclist,50903,58,True
18117460,Chris Horner,,,14095,6,False
18118128,Black Milk,Detroit,Your Favorite,9993,106,False
18118234,JBAR,Wouldn't U Like 2 Know!,S.O.D. Money Gang http://tinyurl.com/cfbueg New Mixtape Voicemail Comin Soon! Aim: talk2jbar,19234,205,False
18119262,Homemade Wine,"Palatine, Illinois",Homemade Wine - Making wine has gone back thousands of years. Join this fascinating journey to learn and share about the art and science of making wine at home.,15760,17334,False
18119333,Karriann Graf,"San Diego, CA - Florida Keys",Social Media Consultant helping Real Estate Professionals use social media applications to increase their connection with clients and customers. ♥♥ Quotes,14719,14696,False
18121619,brown girl,USA,all things famous and fabulous..,64627,348,False
18123507,Freeway,"ÜT: 40.272321,-75.318814",Check out the Month of Madness!,10551,324,False
18124756,Zac Brown Band,"Atlanta, GA",Chicken fried!,13276,1223,True
18128265,Tyler Florence,"San Francisco, California",Restaurateur,12617,360,False
18130749,Adrianne Curry,South Bay of LA,Living Everyday Like It's My Last,34144,28,False
18137030,Tiago Leifert,São Paulo,Sol com chuvas isoladas.,10612,15,False
18139329,Adam Goldstein,"ÜT: 34.075921,-118.386573",I AM AM,79209,194,True
18139461,Celtics.com,"Boston, MA",Celtics.com's Peter Stringer brings you the Official Feed of the 17-Time World Champions.,14403,40,False
18140897,XxSexyRavenxX,northampton,"I'm single! for now, lol ^^;",11990,7,False
18142856,RCA Music Group,"New York, NY",The Official Twitter Page for RCA Music Group. For more on RMG artists check out http://www.rcarecords.com and http://www.jrecords.com,9645,1477,False
18150955,Ron Hagenhoff,"Honolulu, Hawaii","I'm losing 100 lbs by Jan. 1, 2010 My start weight is 284.4 on June 15, 2009 My weight on Jan1 will be 184.4 Watch my progress and cheer me on!",10391,10939,False
18153673,Mark,Australia,"Mark, first home buyer who runs the Suburb View network of web sites.",49732,54166,False
18156146,Sophia rossi,"ÜT: 40.728695,-73.984719",sofifii not SOFIFI,14324,137,False
18157192,dante jarabelo,Philippines,"Web Developer(PHP/Java/AJAX) turned WordPress Blog Guide, Attraction Marketing Practitioner, Internet Entrepreneur and Prosperity Student",11181,10849,False
18160766,idealpinkrose,Korea,,23510,25806,False
18164244,BobSchaller,"Lubbock, Texas","author of 40 books, college professor",12255,11594,False
18168823,saman rahmanian,"Boulder, Colorado","Interactive AD at CP+B. As a personal attempt to rid the world of unemployment, I've started Tischen. A site that lets you find helpers who are available - now.",13512,12022,False
18170896,Dr. Sanjay Gupta,CNN Headquarters - Atlanta,CNN Chief Medical Correspondent; Neurosurgeon,475738,142,True
18171035,jessejanerocks,,,12812,49,False
18171314,Cindy Leavitt,"McCall, Idaho","Madly in love with my Maker! Married love of my life for 27 yrs, with 5 kids.2 girls left at home. Delight in helping slap biz's into THE PHENOMENAL ZONE!",27956,24747,False
18171416,Keith Brown,"Girard, Ohio","A dedicated husband, father, cross-country coach, marathon runner, and full time network marketer. www.eirobiz.com",16248,14003,False
18175220,Joe Simpson,"Los Angeles, CA",,22417,35,False
18177016,Obama Inauguration,"Washington, D.C.",The Official Presidential Inaugural Committee Twitter,14845,8312,False
18177126,G. Stroumboulopoulos,416,The official Twitter of George Stroumboulopoulos of The Hour and the Strombo Show. The other ones are fakes.,20452,558,False
18178083,JoeCrump,Indiana,Real Estate Investing Training - Learn to make a great living and build a low risk real estate investing business for free.,21881,22425,False
18179554,Women Social Media,Canada,Christine Korda -social network glutton who loves connecting with new people -working at a social network for women - www.shesconnected.com,10791,5369,False
18181521,Marie Luv,Sunny California,18 &amp; over only please. I am the TOP BLACK FEMALE PERFORMER in the industry right now &amp; the QUEEN OF TWITTER. I'm 100% real &amp; hold nothing back.,12968,62,False
18183592,RentToOwnHomes,Big Sky Country,"At Rent To Own Homes, LLC. we are looking for nice homes in nice areas that we can rent to own!",35272,36453,False
18185124,Jeff Bullas,"Sydney, Australia","Internet marketing, including Social Media, Blogging, SEO, Twitter",19778,20554,False
18185416,Gloria Velez,"Ft Lauderdale, FL",Ya girl Glo does it all -- model/actress/rapper,13698,125,False
18188683,Severa PSA (Tiina R),Finland,"Severa 3 is an online application (SaaS) for project management, sales, CRM and invoicing automation. It's free for one user.",12242,10993,False
18190044,MAX B,Harlem,feature and booking info: (503)333-7868,14715,38,False
18191676,islandprincess2,"South Padre Island, Texas","Motivational speaker, writer, blogger, provides personalized offshore or bay fishing trips for Gladiator II Adventures, SPI, TX",42061,41802,False
18194787,Andrew Devine,Humboldt State Univ.,"Special Education Teacher, Network Marketer, give and help others, one love.",10949,9996,False
18197498,BobVila.com,,"The Twitter home of BobVila.com, the leading site for the do-it-yourself community giving homeowners all the information they need to get the job done.",562236,17,False
18197756,Carlos H. Vilela,"Belo Horizonte, MG, Brasil",Planner - BH,14935,16415,False
18198400,phil_hellmuth,Palo Alto,Professional Poker Player,17681,1,False
18201114,Maxim Magazine,The World,"Guys' Ultimate Guide to Celebrities, Gear, Hot Girls, Photos, Videos, Sex, Women, and Sports",12978,6044,False
18208354,Joe Rogan,HELL-A,Stand up comic/mixed martial arts fanatic/psychedelic adventurer/occasional tv whore,52340,275,False
18210497,Viralwordpress,Daytona Beach,Viralwordpress and Software Development,9857,9716,False
18211473,Ben Wade,California,A dude that loves to write humorous and pop culture relevant articles @ his site Loyal K*N*G.,41474,43172,False
18213546,JohnZajaros,"Cleveland, Ohio",Discover The Internet Marketing Quest Revealed! http://thequestrevealed.com,14624,14541,False
18215165,Dirk Henningsen,"Kiel, Germany","Internetmarketing, eBook-Author, Internet, Walken, Gymnastik, Austausch mit anderen Menschen, Contact to other people",36352,34516,False
18216080,robert kelly,,,10312,86,False
18219976,Rede Globo,Brazil,A gente se vê por aqui!,25000,4,False
18220175,iamdiddy,EVERYWHERE!!!,KING COMBS,1544629,157,True
18221923,Drew Williams,Toronto,"CEO of Williams Design Studios and Marketing Director for Vital Insight Group, Editor for Tweeplemagazine.com, designer of Tweepular.com",9924,10614,False
18222378,50cent,NYC,The Real 50 Cent,1117809,13,True
18222599,Lloydbanks,NYC,The Real Lloyd Banks / G-Unit,39293,10,True
18222770,Tonyyayo,"Southside Jamaica Queens, NYC",The Real Tony Yayo,23328,32,True
18222808,TwittMarketing,United States,Social Media Advocate,49006,45347,False
18227519,morningmika,"New York, New York",Somehow raising my two children while balancing my third child-- my job!,10581,12,False
18228898,John Legend,"New York, NY, USA",The Real John Legend,701922,63,True
18230590,ezpcjobs,duh...Home!,"My Home Based Business supersite. News, reviews and advice from me!",32571,35830,False
18231373,Rovaal Rotemon,NC,"http://ZeroCostMarketing.com - Alex Jeffreys student, learning marketing from Alex, sharing experiences with fellow entrepreneurs and giving value to everyone.",11478,9816,False
18232278,guy allon,"London, England","A fun filled guy who’s here to blog-stigate, commentate, inspire &amp; gesticulate, vlog and educate in an entertaining and wonderous way!",10330,10364,False
18234790,"Fuck You, Penguin",,,9911,0,False
18234841,Themelis_Cuiper,Amsterdam Europe,"Positive Solution Thinker Say Hi TC... and i listen to You ! Let's talk about You, Me, our Friends and Fun. Start twitter me with: Hi TC...my idea of fun is:",19344,21185,False
18236230,Jeffree Star,Orange County,my ONLY twitter account!! YES it's really me & I respond to my amazing fans!! FOLLOW ME 3s,61929,91,False
18238282,Sean Malarkey,Columbus OH,"Expert List Builder - Blogger - Internet Junkie - Full time Real Estate Investor. Husband, Dad, Good friend to many...",88606,96745,False
18244345,Will You At Me,"Los Angeles, California","www.WillYouAtMe.com = DJ @Lotay || Find @Lotay's #Blips, #Tunes, #Music, and #Quotes here! #RockOn",15883,14836,False
18244358,National Geographic,"Washington, DC",Follow us for the latest on what’s happening at the National Geographic Channel in the U.S.,22789,3621,False
18246994,Jenny Ferns,"Victoria, Canada","Psychologist and Trainer/Consultant CCPro/Wealth Masters International, Internet Marketing Training, Financial Education, Personal Development for Wealth.",13965,13530,False
18250327,Niche Titans,Sacramento,"Niche Marketing, Internet Marketing, Link Building, SEO, and solving the Rubik's cube in about a minute and a half.",37228,32622,False
18251618,natalie_gulbis,Las Vegas Nevada,"Age 25, Live In Las Vegas, LPGA Tour Player, Goal to Open up a Boys and Girls Club,check out my personal website..nataliegulbis.com",19135,129,False
18254005,Mini Garden,United States of America,"Container Gardening brings much joy. From indoor potted trees to outdoor plants that are more manageable in containers, this is a hobby many enjoy growing into.",17304,18869,False
18255301,Restaurant & Hotels,"Based in St. Louis, Mo.",Hospitality Focused Guest Experience Measurement Company Serving clients all over the world. Also check out @GuestPulse - Tweets by GaryTripp,17826,19681,False
18256661,a flying Laurence,"Sherman Oaks, California",Proceeds go to Charity!!!,26327,24059,False
18257051,Hameed_Hemmat,"Palisades Park, Nj / New York",My mom told me to get a great Job.....I decided to be an Entrepreneur and drink MRP shakes all day. I'm into shaking things up!,27699,29876,False
18257163,My Iguanas,60074 - USA,Site about my iguanas. Here you can keep up with what Spiker and Little dude are doing. Occasionally the hoomans may answer questions and talk stuff here too.,10801,11774,False
18258085,Real Andrews,Connecticut,"JESUS!!!,Freak,Plyd Taggert on ABCs' GH,Fitness,Health n Wellness,Love Puerto Rico,There is no such word as can't!!! A Difference maker with a Doberman Mindset",12928,13038,False
18258178,lisahickey,"Boston, the world",Slightly insane creative thinker and writer. Designer and strategist. Global conversationalist.,21499,22193,False
18262352,Steve Jankowski,Minnesota,"Christian,Husband, Father of 4 daughters, Attorney, Ret Marine, Online Marketer, Self Branding teacher, and totally determined dude",29322,30523,False
18262412,David Snape,"Overland Park, KS",I'm here to vibe and hang out with nice tweeple. Feel free to ask me questions or tweet me any time!,17857,17316,False
18265550,Ben Irawan,Australia,"A husband, a father, a son, a brother, a friend, a pastor, a leader, a mentor, a coach, a businessman, a warrior.",27800,25193,False
18270755,LPT365™,"Syracuse, NY, USA",Leading educator. Educating leaders.,29401,29690,False
18271625,Bloc Party,"ÜT: 51.154446,-2.541567",,18363,283,False
18276100,Bear fan Ron Show,"Chicagoland, Illinois","I host a sports and Political talk shows on BTR.I love the Lord, love to blog, I'm a huge Chicago Sports fan, football fan and fan of food. #GG #TCOT",59274,59683,False
18277078,Bryant Smith,"Boynton Beach, FL",Web designer/developer/programmer/marketer/consultant . (+ SEO &amp; Social News marketing). You can email me at: twitter (at) bryantsmith.com,44223,47471,False
18278629,ErykahBadu,im in mid air,i will not pop 4u or break 4u or hate for u or even hate u,36763,1775,False
18280708,Julia,North of Boston (like Frost),"I love tea, photography, and laughing with the great people who inspire me. I keep the Design Pepper team focused and on-time!",34021,22538,False
18281850,ianpattullo,Barcelona,"Martial Artist, Personal Trainer, Strength and Condition and Nutritionist. http://ianpattullo.blogspot.com/",14368,13800,False
18290616,kristal morris,"Austin,Texas","Advertising entrepreneur strategically merging legacy & electronic marketing for max ROI. Wife, mamacita, foodie, jet-setter, design-obsessed, runner",10399,10491,False
18291413,Pregnant Jane ,"Houston, Texas",What!? I'm pregnant!? How!? When!? Uh Oh. We're blogging about our ENTIRE pregnancy adventure SECRETLY. Not even family or friends know. But now you do....,13411,14714,False
18293107,Kelly,"British Columbia, Canada",Entrepreneur. Fitness Athlete. Life Coach. Marketer. Designer. Artist. *Mocha-Purse-Shoe Addict* ☼Living Life With Intensity n' Fire☼,15271,14992,False
18297088,Rafinha Bastos,,Eu sou um idiota.,172587,43,False
18302144,katiebustin,"Sandy, UT",http://myspace.com/bustinamove7,20823,20940,False
18302410,Betty Fellows,San Francisco Bay Area,Thriving in a challenging times by creating Health and Wealth with Internet Marketing.,11146,12261,False
18311496,David Riklan,"Marlboro, New Jersey",Founder of SelfGrowth.com and creator of the 101 Great Ways to Improve Your Life Series,19867,19225,False
18312906,Michael McAllister,"Tucson, AZ","Life Connoisseur, Sr. in Retailing and Consumer Sciences at the University of Arizona, Art Enthusiast, Entrepreneur and Knowledge &amp; Thrill Seeker!",47100,50125,False
18312960,YoungRepublicans.tv,United States,Youngrepublicans.tv is a web-interview headquarters designed to engage youth by connecting America's brightest up-and-coming Republican leaders. #TCOT #SGP,12672,12788,False
18313204,American Elements,"HQ:L.A.,Ca +UK, Brazil+China","Science Technology from American Elements- Nanotechnology, Robotics, AdvancedMaterials, AlternativeEnergy, Lasers, Military, GreenTechnology, LifeScience, Space",34000,37151,False
18313342,Ronald Porter,"Philadelphia, Pa","Master Modelmaker and Mold Maker for 30yrs, Guru of comic book and comic art investing, classic car collector and enthusiast",11121,12233,False
18315727,Tom Simpson,A Place Called Chevy Chase,"Helping people see what they cannot see so they can become what they want to become, and, have the Life they've always dreamed of.",10805,11884,False
18318091,matt_snow,AZ,http://muscletruth.net,19081,19169,False
18318176,Jonney Jay,London UK,A student of Alex Jeffreys blogging and sharing what I am learning about building an online business,10309,10929,False
18323933,Junaid,"Detroit, MI, USA","Husband, father, blogger",10983,11785,False
18326837,mrbobbybones,"ÜT: 30.627324,-98.307904","host of the Bobby Bones show. Syndicated out of Austin, Texas.",11899,66,False
18332323,Terry Upton,"Brisbane, Australia","Professional Monopoly Player, Personal Development Practitioner, Face Melting Guitar Shredder, World-Wide Globe Trotter, AND Bad-Ass Internet Marketing Genius!",17800,18410,False
18333749,beiler,USA,my goal is to help people have financial freedom that you can do what your heart desires,10719,11790,False
18343779,nikhil_parekh,"Sydney, Australia","Internet Marketer,Affiliate Marketer, World Class Public Speaker, Trainer, Coach & Mentor to Thousands",38352,32687,False
18345963,Gabe O'Neill,"Frederick, Maryland, USA",CoFounder of KidsAreHeroes.com with @MMsMusicForLife. Kids can make a difference. See blog at www.justgabe.com,12588,12826,False
18348619,Bizz (Cheers),"Marietta, Ga",Back Pak Kids / Cheers Music,11374,50,False
18349074,Nicholas,"Eden, Utah","Avid Martial Artist, Social Media Marketing Rockstar, *Enlightened Entrepreneur* With Much Love For All That Is. I Sincerely Thank You For Connecting With Me :)",25356,26066,False
18350406,Paul Galloway,Kansas,"Husband, Father, Christian (LDS), Author, Software Developer, Product Launch Tech Guy, Internet Marketer, The next American Idol !",16725,17854,False
18352504,Charlemagne Solanor,Philippines,"Business Development Head at PlugUrAds.com, gadgets and electronics wholesaler at WholesaleElectronicsLand.com, Internet marketer",11150,11024,False
18352945,Jack Hughes,"Vancouver, Canada","Internet marketing, software developer, writer, social networking, travel expert",21160,18885,False
18353813,Miley Cyrus,LA California,Offical Miley Cyrus,78194,1,False
18353829,Mickey Factz,"Bronx, New York",,11616,266,False
18354898,Will Black,Seattle,I'm all about the funny videos. The world is a better with laughing people in it!,11639,11579,False
18358516,SandyMorris,Florida,"An Official Baby Boomer,internet marketer and known as a good listener.",17964,18703,False
18361101,FakeFranco,"iPhone: 37.609070,-122.393784",I'm fuckin' Harry Osborn bitch! Let's get wasted!!,21711,53,False
18362376,cityspur,"Round Rock, TX","CitySpur is an online destination that reviews the best restaurants, businesses, services, and everything else you can imagine in the US.",20957,20770,False
18363508,Jason Pollock,BROOKLYN,"Filmmaker, Writer, and Activist. I just directed, The Youngest Candidate, a feature film about teens who run for public office.",59173,61272,False
18363737,Ian Alexander Wood,"iPhone: 51.637947,0.437374","Web Designer, Musician, Olympic tea drinking champion.",14728,13364,False
18365169,Maria Johnsen,Norway,"Love Trondheim, travel; make people laugh, cooking, programming, sport, sci-fi, cartoon, comedy",12047,12201,False
18369265,Chris Cooley,Virginia,,10936,41,False
18369581,postsalot,"Orlando, FL","Internet Marketer, Business Owner, Small Business Consultant, Floridian, Entrepreneur, Mom, Student of Life",13885,13231,False
18369812,HIGH TIMES Magazine,New York,We get more done after 4:20 than most people do all day,10625,396,False
18370690,DJ Suss.One,,"The Feature Presentation, DJ on Power 105.1 fm",10142,1713,False
18371803,San Antonio Spurs,"San Antonio, Texas","The official Twitter feed of the San Antonio Spurs, mostly tweeted by Ben Hunt of spurs.com. Follow for real-time Spurs updates and info. Go Spurs Go!",11991,2734,False
18378334,Andy Burton,"Rojales, Costa Blanca, Spain","Property Sales & Management for the South Costa Blanca, Spain. Property Sales in Spain. UK Property Investors/estate agents needed!",14914,15689,False
18378446,JackAllTimeLow,,,51279,19,False
18379329,Paul Merriwether,"Oakland, CA",Providing Online Training 4 Home Based Business Industry,21879,23852,False
18388829,Chris and Phil,"Brighton, UK","Chris and Phil Present... Insightful, intelligent film reviews and nonsensical chatter. The ultimate Movies / Nonsense Podcast: http://chrisandphilpresent.co.uk",13392,13620,False
18390790,Nacho Bottinelli,"Buenos Aires, Argentina",fundador y CEO de Leppus.Deportista apasionado y fanático del Social Media. Tealosopher,17789,15655,False
18393773,Neil Gaiman,mostly near minneapolis,"will eventually grow up and get a real job. Until then, will keep making things up and writing them down.",808792,384,True
18394257,Stephen C Vanderver,"San Antonio, TX","Father of two teenage boys, Social Media &amp; Technology Enthusiast, rookie Blogger, love to share great ideas, constantly in search of perspective",15604,15292,False
18394443,Shelly Roche,east coastish,"libertarian; CTO for breakthematrix.com, iPhone/drupal/open source developer; expert cat-arranger; hermit; plenticulture.com; on FreedomWatchOnFox.com",12235,12208,False
18395177,solange knowles,,"water, melanin, bones, blood.",233888,93,False
18396070,LeVar Burton,"Los Angeles, CA","Actor, Director, Educator",834999,89,True
18396317,Michael Ogden,"Orlando, Florida",I'm a longtime 'behind-the-scenes' Internet Marketing guy (since the mid-1990's) and huge fan of the Pittsburgh Steelers and Orlando Magic.,17871,18212,False
18396883,John Patterson,Otley West Yorkshire UK,Internet marketing student of Alex Jeffreys freebies list building biz opps mixed in with golf horse racing and most things sport,13302,13212,False
18398615,The Core DJ's,"ÜT: 25.811062,-80.155672",The World Most Influential DJ's,14339,2156,False
18404257,ProfitsRx™,"Highland, Utah",The Prescription For Profits.,11347,11390,False
18405160,James Kerrison,"Hobart, Australia","Fat Loss Specialist from Hobart, Australia. Doesn't read DM's but would love to talk via @. Collects M&M's dispensers!",11822,11352,False
18408250,"Bill Murray, MBA","Los Angeles, CA",Lead Sales Trainer at RSA Employee Training. We are on site sales trainers to Fortune 500 to start ups. Our philosophy: building great relationships.,11407,3984,False
18408457,RHYMEFEST,"CHICAGO, IL",El Che. Strength &amp; Perseverance.,10989,49,False
18411779,bravemedia,Vancouver,"Vancouver Internet Marketing Firm specializing in social media, Facebook and Youtube emarketing",11147,10861,False
18420140,Brooke Burke,"Malibu, CA","Co-CEO of Modern Mom, celebrity mother of four. Read my daily blog http://modernmom.com - real, soulful, honest. Founder of BabooshBaby.com",916069,10,False
18424282,Low-Stress Income,Arizona,"Low-Stress Income: Relax, Have Fun, Make Money! Join our FREE Affiliate Program 2.0 Now...You Can Earn $200+ Per Day Online.",20005,17542,False
18424661,JackSimz,Malaysia,"Online tech user & webs developer. Love Web 2.0 apps, online tips & tricks, hot search digital information, news, entertainments, useful web tools & resources.",14485,14888,False
18426610,Shane Gorry,Australia,,27213,27301,False
18426725,P v. Borssum Waalkes,"Zandvoort, The Netherlands","FT Web / IT Biz Owner &amp; Marketer creating Viral Products like Niche SuperVisor &amp; 2Start.us keywords: Buzz, WoM, Advertising, Traffic, Affiliate, SQIP",26826,28385,False
18426852,Dr.Larisa Varenikova,Ukraine,"Executive Search Consultant, Head Hunter (CEO search worldwide), Social Media &amp; Networking Adviser, Network Ambassador",15792,14982,False
18426947,SteveStelzner,Chicago,"x-Int'l Mgt Consultant (Productivity Improvements),Surfer when near an ocean,Entrepeneur,Dog Guy and Outdoors Enthusiast",11892,12313,False
