id,name,location,description,followers,friends,verified
23645923,John Cruise,"iPhone: 26.295181,-80.204369",A web site designer and developer with over 10 years of IT experience. Currently developing numerous commercial and personal web based applications.,11736,10917,False
23648057,Sean Kingston,SumWhere IN TWITTERVILLE,"Popstar,Producer,Actor,C.E.O Of T.I.M.E",73360,420,False
23653153,Guga Kuerten,"Floripa, da Lagoa até a Brava",Tenista. Ex-tenista. Calouro de Teatro na Udesc. Surfista. Filho da Dona Alice. Femônemo.,3730,848,False
23654341,suzi perry,west london,gadget show/motogp presenter/journalist/good egg,14971,24,False
23668206,Organic Groov,"USA, Chicago","Indie Music Show Online filmed in front of a live audience, featuring artists from around the world.",10577,9148,False
23674473,Lee Evans,,"mmm, what? Me? When?",12498,21,False
23680913,Kevin Nealon,"Los Angeles, Ca.",Accommodator/Apologist/Passive Aggressor,557607,42,False
23685059,SodaHead,"Los Angeles, CA",The #1 Discussion Community,10917,8524,False
23685361,viesearch,,Now tweeting the newest links from the viesearch free link project! Submit your site to get noticed!,12861,14150,False
23690189,Kitty Cat,,Meow...purrrrr...meow,16426,14044,False
23690344,Kelly Clarkson,"Burleson, TX",,41556,48,False
23699904,Steve Levine,"Suburban Philadelphia, PA","Passionate about marketing research, music, sports, healthy food, and an animal lover. http://www.linkedin.com/in/stevenlevine1",11067,11419,False
23702397,TEYANA TAYLOR,HARLEMMM,I AM MCLOVIN,67025,88,False
23703690,WookieMunch,California,It's like Chewie Chew. Get it?,21841,23879,False
23707913,Ed Entrepreneur,USA,Real World Serial Entrepreneur Evangelist Promotes Believing in You!,31839,30718,False
23709396,Derwin Lucas,Maryland,Former Corporate Exec Turn Online Marketer who gives until it hurts. :),12120,12051,False
23711425,MICHAEL HEINIGER,"Webb City,MO","Follow Jesus Christ 1st, Serve others,enviromental stewardship,love animals",17461,19061,False
23719300,Meagan Good,"Los Angeles, California",The Official Megan Good Twitter Page!,56106,72,False
23720063,BullsandBeavers,"Sun Valley, Idaho","The premier online resource for outdoor sportsman, hunting, fishing, news and social network. Where men and women connect to pursue their outdoor passions.",13632,14445,False
23726874,Lindsay Lohan,LA/PARIS/NYC/LONDON,Sevin Nyne and 6126 by Lindsay Lohan,199150,95,True
23730457,Sarah Ellis,United States,Just a working mom with 2 beautiful children!,13028,9845,False
23741531,Ruby Rose,"ÜT: -33.933089,151.179147",,17940,61,False
23746241,Ed Lover,Up top!,The official business chameleon!,35874,186,False
23748448,Bring Me The Horizon,"Sheffield, UK",,17390,6,False
23748699,Free,,,87210,187,False
23750124,ஜ Floresdeplástico ஜ,Brazil,Aprecie SEM moderação ;),18692,17912,False
23762559,Ann Stark,,,11719,11602,False
23772472,Dennis K,California,"Welcome to the furture home of TraderTweets.com. A destination for traders to share ideas on Stocks, Options, Forex, and Futures. Stay tuned for updates!",11330,10329,False
23774237,FaithGoddess,International,"Faith Evangelist and Free Spirit. My purpose is spreading a worldwide message of God's supernatural love, faith and hope within you for creating a better world",18722,18612,False
23775037,Mike Garrick,"Johnstown, PA / Dell City, TX",Businessman - Rancher,11060,11516,False
23778898,J.A. Adande,,,17003,170,False
23783972,Sunshine Megatron,"Los Angeles, CA","- Owner of T-Shirt Hell, making love extraordinaire.",17238,14,False
23785337,Molly Duggan,"San Francisco, CA",,15431,13550,False
23793665,Samuel Jay Hancock,"Tyler,Texas/Nashville",Vocalist of the band Luminate. Fight the Process! and live in spirit! God is faithful! blog is: sam-luminate.blogspot.com :) twitter.com/LuminateBand,16003,59,False
23795109,RayJ,,,72908,26,False
23804345,Ken Baker,Hollywood,"Covering Hollywood life, staying positive, producing joyfulness, being hopelessly devoted, and breaking news: that's what I do!",14460,40,False
23807762,MEGAN GOOD AKA MEGS,,,10518,0,False
23808856,CNN.com Writers,"One CNN Center, Atlanta, GA","News desk writers for CNN.com, looking to share our stories and help tell yours to the rest of the world on CNN.com",11416,1400,False
23813594,Kimora Lee Simmons,International,Hey What's Up Peeps Stay Clicking On My Page For The Info You Need On Me And My FAM BAM Laters.,45078,127,False
23818590,►Dave◄ Vacation Info,US & Worldwide (ABQ),☼ Travel ☼ Tourism ☼ Tips & Advice ☼ Destinations ☼ Attractions ☼ Events ☼ Festivals ☼ Theme Parks ☼ Cruises ☼ Activities ☼ Road Trips ☼ Hotels ☼ Resorts ☼,27403,30142,False
23821484,Olanrewaju Bankole,England,"Project/Program Management, Digital Marketing Student, I always follow back.",21414,20805,False
23831682,Reagan Gomez,,"It's your girl, Reagan Gomez. I'm an actress, wife and proud mother. Just getting on the Twitter band wagon. Thanks for checking up on me!!",19097,135,False
23832022,Rev Run,Worldwide,"Husband, Daddy, King of Rock, Rock Hall of Fame Inductee, Star of Hit Show Run's House",180394,0,False
23852689,Alisson F. de Melo,Brasil - São Paulo,"17 anos, 3ºEnsinoMedio, timido, simpatico, viciado em tecnologia; I LOVE MUSIC, I love New York (L); Publicidade ou Design!? Quer me conhecer mais? follow me",14644,16106,False
23855299,Michael Yo,L.A./Miami/Houston,"E! News & D10 celebrity correspondent, Y100 host, The half Black Brother with a Korean Mother and the guy Chelsea always makes fun of",10550,40,False
23857276,★Joy Rogers✔,"Eufaula, Oklahoma",Promoting tourism and relocation to our area via the Internet and Internet Marketing Coordinator for Century 21 Debbie George and Associates,9245,8329,False
23857315,Larry Miller,"Puyallup, Washington",Internet marketing master. Single father of 2. I follow you back. creativewealthunlimited.com Facebook profile.to/lrmiller1983 MySpace myspace.com/lrmiller1983,14041,15031,False
23859156,maya arulpragasam,None,None,57566,58,False
23862822,Donald Powers,TEXAS,"Love Golf, Still trying to break 80. Also like to play basketball and workout, because I am a huge health nut. Currently work with the best money marketers.",12168,12373,False
23865496,Spectacular Smith,"ÜT: 34.787918,-77.403992","Request New Single Tipsy In Dis Club! On your radio stations!! 1/4 of Platinum Selling Group Pretty Ricky #1 Album in 2007, CEO of Spectacular Ice Jewelry Co.",27649,361,False
23866990,Mufi Hannemann,Honolulu,Mayor: City and County of Honolulu (Official Account),558123,58,True
23870788,San Marco Coffee,"Charlotte, NC","The original fresh roasted coffee to order website, full selection of coffees, 270+ flavors, espresso and more! Drink the BEST don't settle for less!",19607,20220,False
23872098,Chris Crocker,Los Angeles,"I'm a flat-chested, big-brained she/he superhero. This is Chris Crocker, fatherfucker. Follow me, or Be Lost. ;)",46728,75,True
23885448,Agent Ken,USA,"Real estate agent directory, realtor directory, realtor marketing, home search, Real estate information",14213,15945,False
23890660,Nick Jonas,USA,Official Nick Jonas!,10196,17,False
23892772,Denyce Lawton,"Hollywood, Ca",Series Regular on Tyler Perry's House of Payne. I Play the character Dana in the barbershop!,12349,283,False
23898154,Tom Troughton,"Asheville, NC","Reviewer of Web Marketing Material. Blogs, Web Design, and Internet Marketing",39956,38977,False
23911410,Bam Margera,West Chester,,48707,9,False
23912766,tiffany pollard,City Of Angels,Reality Breakout Diva Type,24738,1995,False
23918315,TK Carsites,"Orange County, CA","TK Carsites is an automotive website, SEO, and social media marketing vendor in Orange County, CA",16951,17665,False
23922282,danny masterson,tribeca.E hollywood.park city.,born in NY.moved to LA at 16.got paid to model in '81.got paid to act in '82.stopped gettin paid to model in'91.got paid to DJ in '97.got paid to remix in '08.,648781,6,False
23932610,Dakota Rae Patrick,USA,"The Official Dakota Rae Patrick Account. Don't Just Sit There, Be Interactive With Life",23758,23732,False
23932737,AD Lane (Filmmaker),South London,Writer/Director/Producer of INVASION OF THE NOT QUITE DEAD - coming 2010 - (Help us to make film funding history),10401,9386,False
23939797,Avatar【ツ】♫ ❡★,Sydney / New York ➲ M@thew Fry,Pixels4Peace™ B the CHANGE U wish 2c in the world. Make a˙ WrldShft Ntwk Oz Director. Wizard. LoA Micro-Blogger. Sharing ❤☮☯ w/ U! ✌☺☻ ƸӜƷ Tweet'n4Peace! ☆☆☆☆☆,13149,14464,False
23943320,R. J.,Toronto,"Create your own FREE homepage with tons of apps - Facebook, Twitter, RSS feeds, Blog updates, plus tons of other gadgets. http://wakooz.com",20896,21033,False
23943985,Davina S,Europe,"I am a natural intuitive, hypnotherapist and Reiki Master, I have a common sense approach to all things spiritual",14992,15697,False
23947265,Zechariah Parker,"Youngstown, Ohio","I want to connect with intelligent human beings. The more value we share with eachother, the more value we gain for ourselves... ;-)",18346,18227,False
23950893,joel timothy houston,None,None,12045,77,False
23954327,WallStSource,14 Wall Street New York,"News Aggregation - Financial , Business , Sports , Political and Topical . We aggregate and link you to the Top Stories from over 500 Web Sources",12211,11153,False
23960048,scott young,maine,Need a wholesaler for your business check out my site,14649,14982,False
23967578,Terrell Owens,Buffalo NY,,64859,59,False
23971640,Jer.Sara.Pain,ChaingMai Thailand,"#1laugh LaughinFun CheerLeadin LuvinGod GoGivers SaraHerbNurse Owners: PainStopped We have 24,000 + followers This Is how we Do It http://tinyurl.com/nfldb9",24775,22628,False
23976386,David Guetta,"Paris, FR",,14909,92,False
23993598,.Music Web Domain,"Los Angeles, CA, USA",".music (dotMusic) is the web domain name extension representing the global music community, giving music entities a unique .music extension web address",19581,21329,False
24019308,iTunes Trailers,"Cupertino, CA","Official movie trailers and theatrical content updates to Apple iTunes Trailers, Apple TV, and for the iPhone/iPod touch on Twitter.",559046,12,False
24019670,Keon Smith,Hollywood Swingin,Hollywood Kazz Means Money And Fuck-You-Ness,11355,138,False
24024778,Kal Penn,Tehran,"New Jerseyan, actor, student, writer, and organic composter.",22928,47,False
24025298,Home Equity Loans,"New Orleans, Louisiana",This is must do prorgam. Puts income in your pocket every single day.,11583,12539,False
24027730,ESPNEWS,"Bristol, CT","LEGAL NOTICE: If you send us a tweet, you consent to letting ESPN use and showcase it in any media, possibly even on tv.",19071,23,False
24027953,Rainer Seiffert,"Aachen, Germany","Academic Degree: Dipl.-Kfm., Entrepreneur, A/D/H Consult Chief, Consultant for 30 years, Dad of 4 Children, Christian, Economy, Theology, Philosophy, Karate.",26985,27402,False
24044141,Boss,,,9121,67,False
24046630,P DIDDY LOBER,canada,,16083,197,False
24047612,Louis Vuitton US,NYC,The Official Twitter Page For The Louis Vuitton U.S. Digital Media Team,13670,52,False
24065844,Molly Duggan,"San Francisco, CA","Branding | Strategy | Communications, See our website for more.",18248,17318,False
24083587,Katie Price/Jordan,Malibu,Entrepreneur,249531,82,False
24086418,Peter Andre,"Surrey, England",Entertainment Industry,184800,317,False
24089650,Ron Tremper,"Boerne, Texas USA",Did u know people breed reptiles for a living? Want to get behind the scenes of a reptile specialist? Come share adventure and worldwide connections.,9960,10629,False
24090614,Brandon Boshnack,"San Diego, CA",Brandon and Lisa are top income earners in their home business. We teach people how to manifest the law of attraction and get results. We train one-on-one.,18245,17644,False
24112419,worship Word | GOD,,"To receive ONE DAILY Scripture-Tweet TEXTED to You, set your Device Updates ON For worshipWord. * * * Traveling Thru THE PSALMS, Join Us As We Worship GOD !",14454,14139,False
24114909,lisa,,looking to help prepaid legal associates increase their leads!,18599,18151,False
24122752,Super Bowl Sunday,"Houston, Texas",Using the Power of Twitter to help everyone Cash in. You can do this. I will help.,28782,30910,False
24133242,Larry The Cable Guy,USA,The OFFICIAL Twitter home of Larry The Cable Guy,8948,17,False
24139243,Shanna Moakler,In Bed.,,53550,47,False
24144216,Tony Hayes,"Coffs Harbour, Australia","Creator of the Key to Wealth package, the worlds most advanced replicatable website prospecting system.",14246,15627,False
24144274,Arianna Huffington,,Twitter page of The Huffington Post. Get more updates at The Huffington Post website.,16089,0,False
24173293,Media Jobs UK,London,TwitJobs UK - Broadcasting UK Media Roles Direct From Our Website To You,10275,8351,False
24175183,carolkaraoke,"iPhone: 40.665657,-73.851196","Love to sing....lalalala, sees the glass half full!",15232,5100,False
24190981,Teen Vogue,,,19453,81,False
24206535,Susan Cerise,"Saddle River, NJ",Financially Free Entrepreneur &amp; Business Consultant,11581,11224,False
24208687,DiscountPinger,discountpingdom,Discounts and voucher codes that work. Got a great discount ping us and we'll retweet it!,13165,12685,False
24208754,Less Stress,Michigan,"Author of Just One? and Just One...for kids? There's a lot to do in life, get it done, one by one!",17751,18656,False
24224485,Carla Hohenhouse,"Jacksonville, Fl.","I love the penny stocks. High risk, high reward.",16467,17088,False
24231660,CP Science Tweets,"Hoboken, NJ",Current Protocols has just launched the world's most interactive scientific protocol based website!,16039,16277,False
24247270,Michelle Matthews,Toronto,world citizen,18303,18844,False
24248212,Sabrina Sato,Brasil,"Atualize-se com as notícias, fotos e vídeos do fã site da Sabrina Sato | #nãooficial. [Feed]",16672,56,False
24255792,Deutsche Trends,Köln,"Welche Themen sind im deutschsprachigen Raum beliebt? [German, Mashup, DSDS, GNTM, Tatort, iPhone, Hamburg, Berlin]",11533,9842,False
24263801,whitney port,,Check out my official site to see my exclusive pics and videos and to see what I'm up to!,214227,40,False
24278168,Brooke Hogan,miami/los angeles,http://www.myspace.com/brookebollea1 [personal myspace],15161,21,False
24278900,Busta Rhymes,,,98957,47,False
24281654,NLP Modeling,,,19210,17768,False
24285686,Jonas Brothers,Earth,Lines Vines and Trying Times in stores 6/16/09!,422984,0,True
24286351,Jesse McCartney,Los Angeles,Jesse McCartney Official Twitter,69273,3073,False
24291858,Holly Madison,Las Vegas,The Showgirl Next Door,115865,36,False
24296476,MIKA,RIGHT NOW; UK,"long live the golden donkey. may he guard my page. fear the donkey, love the donkey, donkey is GOOD",43000,14,False
24300583,Julie Benz,"Hollywood, CA",Actress...Vivier and Louboutin Lover.... give a girl the right shoes and she can conquer the world!,10198,55,False
24325547,Nick Carter,"ÜT: 33.980028,-118.39211",,40875,10,False
24325657,Howie D,,,19633,9,False
24325840,aj mclean,,,12681,6,False
24326400,brian littrell,,,23123,9,False
24327993,Bruce Haverkos,Northern California,Western states champion emu whisperer and strawberry smoothie thief. I also help entrepreneurs automate their businesses so they can enjoy life:),17692,17529,False
24331426,Johnjay Van Es,"ÜT: 33.604253,-111.982489",THANKS FOR LISTENING! FOR REAL...THANK YOU!,13516,50,False
24332709,Claudia Jordan,Los Angeles,I'm a radio & Television personality working on becoming an executive producer. Host a show on Sirius 106 The Foxxhole-and currently on Celebrity Apprentice,9660,119,False
24336577,Chris Goodwell,,,29138,32053,False
24340604,Annie Duke,Los Angeles,"Professional Poker Player, mom of 4 kickass kids and Ultimatebet.com pro",14619,99,False
24341373,Shannon Leto,,,9203,2,False
24342034,Yung Berg,,LOVE PROJECT COMING FALL 2009,19580,82,False
24347779,INKAHEXE,"Lima, Perú",peruvian shaman of the 4th level (sapha inka). If you follow me I will follow you! Una embrujada peruana. I am 39 years old.,14801,15446,False
24349486,Live Currency News,"NYC, LA, Hong Kong, London",The best currency news and forex fundamental information from around the web collected for your pleasure.,11216,11874,False
24357228,FollowWatch,Internet,Follow the page to receive your invitation,17015,15271,False
24372147,Khloe Kardashian,,,35472,43,False
24398480,Bikinis Bathing Suit,Houston,I am dedicated to making the world a better place by dressing the world with more girls in Bikinis,17848,19624,False
24407244,Dita Von Teese,"Hollywood, California",Burlesque Star Dita Von Teese,90031,77,False
24413299,Sanaa Lathan,"New York, NY",I'm an tony award winning actress,12507,27,False
24415842,colin farrell,,,9065,245,False
24437339,DebtKill,Houston,Start extra income to help reduce debt. Earn $125 today when you sign up.,16270,17188,False
24440532,Denver Snowdude,"Denver, CO","Skiing nut who is also into rock climbing,golf and mountain biking.",18440,19226,False
24446175,YUKMOUTH,"east oakland/hollywood,ca.",YUKMOUTH-THE WEST COAST DON-N STORES MAY 5TH!!,9585,5427,False
24447643,Eddie Izzard,Our Planet,"I'm a British European, I think like an American and I was born in an Arabic country",694002,52,True
24458677,Angie Lee Cobbs,Los Angeles,Bipartisan organization that holds political youth forums for college students and high school seniors.,122593,73,False
24463516,Bed and Breakfast,United States,"The latest news on Bed and Breakfast Inns . We feature inns, specials, events, good deals.",12941,13609,False
24469441,Lucy Izon / Canada,Toronto,Travel Writer - In search of what makes Canada Cool. Join me at CanadaCool.com,21489,21138,False
24472788,gerryPlanetEarth,Tehran,There's No Reason For Racism Or Wars,11665,12544,False
24476639,Kevin Thomas,,I help people in Network Marketing companies build their businesses at the Speed of Light using Internet Marketing strategies http://bbltwt.com/v8f38,19897,19840,False
24490384,FREE T.I.,"ATL, GA",FREE T.I. SUPPORT PAGE!!,22021,749,False
24490678,Hosea Chanchez,California,EVOLVEINGINTHISSECOND,13488,36,False
24493831,charlotte ronson,new york,,13115,94,False
24496399,Peter Bray,"Portland, Oregon",Original and still the best way to find followers!,27294,27944,False
24502450,Joel Madden,Los Angeles,He is I and I am him.....,217091,75,True
24505368,C.J. Kealoha,"Kailua, Hawaii","Aloha! my name's CJ, Hawaii's #1 Twitterer: Pro-Surfer, Pick Up Artist, Internet Entrepreneur, and Night Life Guru.",29132,27653,False
24523660,Denise Richards,Los Angeles,Actress,637984,33,True
24529777,Mike Mizanin,"Los Angeles, CA",I'm awesome. Be Jealous!!!,16498,12,False
24530247,Julia,"Chicago, IL","LPP is a dance-theater company that creates immersive environments through striking visual design and lush, intricate movement vocabulary.",10484,10168,False
24531377,Selena Gomez,Los Angeles,Selena Gomez Personal Twitter,8453,47,False
24531730,Jonathan Cheban,NY/LA,,15336,36,False
24533117,A/D/H Consult,"Europe, Germany, Aachen","Diplom-Kaufmann (FH), banking man, Consulting, Coach, financial advice and credit consultation. I advise people with financial problems and help to avoid such.",21119,23231,False
24545388,Tammy Kahn Fennell,"Long Beach, NY",Losing your shirt on adwords? Let me help you get video and get massive exposure!!,11725,12094,False
24562770,George Benckenstein,"Houston, TX",Digital Media and Interactive Marketing Strategist - Flat World Evangelist,10688,9794,False
24565047,MLM Success Media,California,"Videos, Audios, Books and Other Resources for MLM",26022,25323,False
24566398,Local tweeps,Minneapolis,The hyperlocal Twitter directory. Find/get found by Tweeps near you based on ZIP or keyword. List yourself and follow to get notified of new tweeps near you!,24751,21334,False
24576393,Moises Arias,city of angeles.,"I am no one special, just a guy from the city .",22856,21,False
24579796,Shannon Elizabeth,Los Angeles,"Actress, poker player, producer, upcoming director...",12308,50,False
24599923,alexa chung,new york,i want ice cream for breakfast,46054,57,False
24600082,omarion grandberry,nyc,singer,10712,936,False
24602560,Official Team Jonas,NYC &amp; The World,"Official home of Team Jonas, the Jonas Brothers Fan Club. All the up-to-date Jonas news you need!",11680,8,False
24605145,Chris Fossenier,Center of the World,Not a big fan of Twitter Facism. Proud owner of 3 sticky kids stumbling through the online wilderness,13394,13951,False
24606439,Katt Williams,California,It's Pimpin Pimpin,106884,163,False
24608680,Joel Stein,Los Angeles,I am neither important enough nor unimportant enough to do this.,400454,107,False
24618104,Brighton,USA,"A real life Disney princess who's 27, a total Pixar geek, a wannabe PokerStars pro, and *loves* to laugh! So, whatcha waitin' for? ;) Follow meee! xx",14457,14302,False
24618646,Twitteidoo,"Sweden, Europe","Articles and Marketing devices, about/for Twitter",18323,18581,False
24621955,Tyrese Gibson,Watts California,This Comic will be Unleashed Aug 5th through Image Comics Get Ready!!,197450,584,True
24624309,Nutrisystem,New Orleans,Now You Can Achieve Financial Dreams..easily. Sign up today & get $125 today.,11502,12030,False
24627141,Eduard Sabas,"Bogotá, Cundinamarca Colombia",Freelance Writer and Observer of Human Nature,31487,32127,False
24634782,Tim Scullin,New Zealand,"Entrepreneur, Kitesurfer and learning the web one step at a time! :) Follow the journey timscullin.com",10963,10815,False
24652882,Beyonce Knowles,LA,,13005,65,False
24652991,Jessie Jackson,,"guzzling coffee, trying to launch new web2rule.com",17052,17835,False
24655802,Fergie,,,29860,63,False
24659388,Die Welt,,"Nachrichten und aktuelle Informationen und News aus Politik, Wirtschaft, Finanzen, Wetter, Sport, Fußball, Kultur, Literatur, Reise und Internet",10222,10854,False
24661425,Daniel Boix,,,10868,11907,False
24668720,Oliver Phelps,England,"I started acting when i was 14 playing George Weasley in the Harry Potter series. I play golf, soccer and other sports when i can. I also like to travel.",12410,16,False
24673002,Battlefield 1943,"Stockholm, Sweden",This is the official Battlefield 1943 twitter page where you'll get a peek into what's happening and learn where to look for the latest Battlefield 1943 info!,12965,7,False
24689055,Twooting.com,"Sudbury, MA",Twooting is the new daily podcast all about Twitter. Find us on iTunes or at Twooting.com. Join us for LIVE video broadcast M-F @12pm EST at Twooting.com.,24915,20142,False
24700916,Golf Home Exchange,"Freiburg, Germany",Golf Home Exchange is aimed at the Golfer who would like to exchange homes with other golfers for holidays.,12398,12739,False
24704470,Breast Cancer News,California,The fastest way to find out what is happening with research and treatment methods. We scan the best sources of into.,12442,10022,False
24705126,Shashi Tharoor,New Delhi,"author, humanitarian, peacekeeper, columnist, former UN Under-Secretary General, now Minister of State for External Affairs, Govt of India",16939,6,True
24716460,Jennifer Regan,NYC,I just graduated at NYU. Im a HUGE METS fan. I love helping people. World peace is what I want most. Please follow me and i'll follow you!,12931,12945,False
24716740,Paul,UK,"Forget the people in the past, there's a reason why they didn't make it to the future.",53142,250,False
24719760,DJ CLUE,"ÜT: 40.623104,-73.793502",CEO OF NYC,32730,90,False
24721390,Barry Stein,"Kirkland, Washington",Internet Marketing Entrepreneur - Web site Owner/Designer - Affiliate Marketer - Blogger - Ebook Creator - Beanie Baby Broker - Stock Market Investor,17069,17032,False
24722470,FitnessTown,"Vancouver, British Columbia","The Thinkfitness Challenge was created by Thinkreferrals Business Network and FitnessTown in Surrey, BC",38405,41454,False
24722914,Martin NOL COFFEE,Inland Northwest United States,I am the Co-Owner of Nectar of Life Organic Coffee Company.,10561,10344,False
24725078,Meme Propagator,The Twitterverse,"Dangerous, Viral Ideas Here. I Survive by Replication; Please Retweet.",17516,16565,False
24733117,Jeffrey Levin,"San Jose, CA","Marketing Programs Manager, social media, human rights, politics and news junkie, bleeding heart liberal (and proud of it) Follow Me / I'll Follow You! #hrc",11953,12161,False
24737621,Mathew Horne,London,small actor www.imdb.com/name/nm1328703/,42054,60,False
24740413,Refinance Home Loans,Atlanta,Income Help to Refinance your Home. This is doable.,10556,11178,False
24741685,Microsoft,"Redmond, WA",The official Twitter account for Microsoft Corporate Communications.,11595,101,False
24742957,David Archuleta,Utah,I'm David. I like music.,154656,15,False
24753990,Cynthia Milano,"Phnom Penh, Cambodia",I can be sweet and innocent. I'm definitely not predictable :),28242,26168,False
24762237,BusinessTools ForYou,,Bringing you an ever-growing collection of business tools and resources,29090,28557,False
24766812,Gem Plumbing,,On Site. On Time. On The Money.,10956,11536,False
24774508,LeAnn Rimes,"Nashville, TN",LeAnnRimesWorld.com,30153,35,False
24775205,Michael Price,"Boise, Idaho","Own Network and Internet Marketing Tools company, Christian, Family Man",11821,12724,False
24775528,Nelly_Mo,St. Louis,"CEO of Nelly Inc, Derrty Ent, and a St. Lunatic",11630,35,False
24776235,Donnie Wahlberg,,,86783,13,False
24778959,Fonzworth Bentley,"ÜT: 34.076607,-118.38367",CoolOutrageousLoversOfUniquelyRawStyle,10068,86,False
24787260,TI Clifford Harris,None,None,10756,4,False
24788034,Cameron Hawking,None,None,14316,14403,False
24788620,Nicole Scherzinger,United States,My name is Nicole Scherzinger. I am the lead singer of the multi-platinum selling band; The Pussycat Dolls.,10650,9,False
24790283,Smokey Robinson,Los Angeles,Time flies when you're having fun!,14053,14129,False
24792015,Tools4Success,USA,"Business Tools for Online Success,Home Business Tools, Affiliate Tools,Marketing Tools,Tools for Newbies,Tools for Everyone",23266,23842,False
